{
  "schemaVersion": 1,
  "status": "base-only",
  "updatedAt": "2026-10-01T12:45:32.000Z",
  "targetDropDate": "2026-10-07",
  "baseProfile": {
    "future": 35,
    "deep": 40,
    "jungle": 25,
    "depth": 80,
    "experimental": 65,
    "floor": 60,
    "darkness": 75,
    "breaks": 70,
    "count": 12,
    "mixes": true
  },
  "weeklyOverride": null
}
